{
  "schemaId": "urn:gala:schema:public-generation-marker:2.0.0",
  "schemaVersion": "2.0.0",
  "artifactId": "019c0000-0000-7000-8000-000000000001",
  "artifactDigest": "sha256:0000000000000000000000000000000000000000000000000000000000000001",
  "generationId": "019c0000-0000-7000-8000-000000000001"
}
